{
  "$schema": "http://json-schema.org/draft-07/schema#",
  "title": "pr-review evidence object v1",
  "description": "System of record for one pre-merge review at one head SHA. Written only by the credentialed record job; comments are renderings of this. See README.md in this directory.",
  "type": "object",
  "required": [
    "schema_version",
    "repo",
    "pr",
    "head_sha",
    "run_id",
    "generated_at",
    "findings",
    "trail",
    "investigation_log",
    "history",
    "high_water"
  ],
  "additionalProperties": false,
  "properties": {
    "schema_version": {
      "const": 1
    },
    "repo": {
      "type": "string",
      "pattern": "^[^/]+/[^/]+$"
    },
    "pr": {
      "type": "integer",
      "minimum": 1
    },
    "head_sha": {
      "type": "string",
      "pattern": "^[0-9a-f]{40}$"
    },
    "run_id": {
      "type": "string",
      "minLength": 1
    },
    "generated_at": {
      "type": "string",
      "format": "date-time"
    },
    "high_water": {
      "type": "integer",
      "minimum": 0,
      "description": "Highest finding index ever assigned on this PR; the composer's next ID is F<high_water+1>. Never decreases."
    },
    "findings": {
      "type": "array",
      "items": {
        "type": "object",
        "required": [
          "id",
          "bucket",
          "file",
          "text",
          "origin",
          "status"
        ],
        "additionalProperties": false,
        "properties": {
          "id": {
            "type": "string",
            "pattern": "^F[0-9]+$"
          },
          "bucket": {
            "enum": [
              "outstanding",
              "author-answer",
              "reviewer-check",
              "preexisting"
            ]
          },
          "file": {
            "type": "string",
            "minLength": 1
          },
          "lines": {
            "type": "array",
            "items": {
              "type": "integer",
              "minimum": 1
            },
            "minItems": 1,
            "maxItems": 2,
            "description": "[start] or [start, end]; omitted for file-level findings"
          },
          "text": {
            "type": "string",
            "minLength": 1
          },
          "origin": {
            "type": "string",
            "minLength": 1,
            "description": "What produced it: verdict:<verdict>, model, preflight:<tool>, style-blocker, promoted:<from-bucket>:<reason>"
          },
          "status": {
            "enum": [
              "open",
              "resolved",
              "conceded",
              "disputed-held",
              "accepted-as-is"
            ]
          },
          "disposition": {
            "type": [
              "object",
              "null"
            ],
            "required": [
              "disposition",
              "actor",
              "updated_at"
            ],
            "additionalProperties": false,
            "properties": {
              "disposition": {
                "enum": [
                  "fixed",
                  "refuted",
                  "deferred",
                  "accepted",
                  "not-applicable"
                ]
              },
              "note": {
                "type": "string"
              },
              "actor": {
                "type": "string",
                "minLength": 1
              },
              "sha": {
                "type": "string",
                "pattern": "^[0-9a-f]{7,40}$"
              },
              "bulk": {
                "type": "boolean"
              },
              "updated_at": {
                "type": "string",
                "format": "date-time"
              }
            }
          },
          "detail": {
            "type": "string",
            "description": "The author-card '#### F<n> · Do this' block body (Line/Why/Fix), mirrored verbatim for the evidence page"
          },
          "members": {
            "type": "array",
            "minItems": 1,
            "description": "Set only on a group finding (compose-review's new-feature carve-out): the claims it asks the author about in one question",
            "items": {
              "type": "object",
              "required": [
                "file",
                "claim"
              ],
              "additionalProperties": false,
              "properties": {
                "file": {
                  "type": "string",
                  "minLength": 1
                },
                "lines": {
                  "type": "array",
                  "items": {
                    "type": "integer",
                    "minimum": 1
                  },
                  "minItems": 1,
                  "maxItems": 2
                },
                "claim": {
                  "type": "string",
                  "minLength": 1
                }
              }
            }
          }
        }
      }
    },
    "trail": {
      "type": "array",
      "description": "Verification trail, verbatim from .verified-claims.json — the model never re-renders this.",
      "items": {
        "type": "object",
        "required": [
          "file",
          "claim",
          "verdict"
        ],
        "additionalProperties": false,
        "properties": {
          "file": {
            "type": "string",
            "minLength": 1
          },
          "line": {
            "type": "integer",
            "minimum": 1
          },
          "claim": {
            "type": "string",
            "minLength": 1
          },
          "verdict": {
            "enum": [
              "verified",
              "matches",
              "not-a-claim",
              "unverifiable",
              "contradicted",
              "mismatch",
              "framing-drift",
              "flagged"
            ]
          },
          "evidence": {
            "type": "string"
          },
          "source": {
            "type": "string"
          },
          "route": {
            "enum": [
              "pass0",
              "pass1",
              "pass2",
              "pass3",
              "preflight"
            ]
          },
          "claim_id": {
            "type": "string",
            "minLength": 1,
            "description": "The verifier's id for the claim (c1, c2, …) — the join key back to the run's .verified-claims.json artifact. This and the keys below are verifier metadata, absent on objects written before they were carried."
          },
          "type": {
            "type": "string",
            "minLength": 1,
            "description": "The extractor's claim type (version, numerical, api-surface, …). Open vocabulary: it drives verifier routing, so it is recorded as found rather than validated against a list that would drift."
          },
          "confidence": {
            "enum": [
              "high",
              "medium",
              "low"
            ]
          },
          "framing": {
            "enum": [
              "exact-match",
              "entailed-narrower",
              "overclaim-broader",
              "shifted",
              "none"
            ]
          },
          "framing_note": {
            "type": "string"
          },
          "turn_cap_exhausted": {
            "type": "boolean",
            "description": "True when the verdict is the verifier's terminal turn-cap `unverifiable` — a retryable budget failure, not a judgment about the claim."
          },
          "source_discipline_gate": {
            "type": "string",
            "minLength": 1,
            "description": "Names the source-discipline gate that downgraded this verdict (e.g. generated-from-data)."
          }
        }
      }
    },
    "investigation_log": {
      "type": "object",
      "description": "The 8 mandatory investigation bullets, keyed; rendered on the evidence page and summarized as counts in the brief.",
      "additionalProperties": {
        "type": "string"
      }
    },
    "editorial_balance": {
      "type": [
        "object",
        "null"
      ]
    },
    "triaged": {
      "type": "array",
      "items": {
        "type": "object"
      },
      "description": "Triaged verifier findings (previously the collapsed 📋 section)"
    },
    "style_suggestions_count": {
      "type": "integer",
      "minimum": 0
    },
    "confidence": {
      "type": [
        "object",
        "null"
      ],
      "description": "The review-confidence table dimensions, rendered in the brief",
      "additionalProperties": {
        "type": "string"
      }
    },
    "summary": {
      "type": [
        "string",
        "null"
      ]
    },
    "degraded": {
      "type": "string",
      "description": "Present when the object was assembled without its full inputs — e.g. 'prior-evidence-unavailable' when an update-lane run could not fetch the prior evidence object, so trail/investigation_log are empty rather than carried forward. Absent on a healthy object."
    },
    "history": {
      "type": "array",
      "items": {
        "type": "object",
        "required": [
          "ts",
          "summary",
          "sha"
        ],
        "additionalProperties": false,
        "properties": {
          "ts": {
            "type": "string",
            "format": "date-time"
          },
          "summary": {
            "type": "string",
            "minLength": 1
          },
          "sha": {
            "type": "string",
            "pattern": "^[0-9a-f]{7,40}$"
          }
        }
      }
    },
    "stances": {
      "type": "array",
      "description": "Editorial stances the extractor recorded for the diff (positioning/comparison language). Verdict-free by design — a page's own framing has no external ground truth. Present, possibly empty, whenever the candidate-claims artifact carried a `stances` list; absent when it pre-dates the split.",
      "items": {
        "type": "object",
        "required": [
          "file",
          "text",
          "type"
        ],
        "additionalProperties": false,
        "properties": {
          "file": {
            "type": "string",
            "minLength": 1
          },
          "line": {
            "type": "integer",
            "minimum": 1
          },
          "text": {
            "type": "string",
            "minLength": 1
          },
          "type": {
            "enum": [
              "positioning",
              "comparison"
            ]
          },
          "found_by": {
            "type": "array",
            "items": {
              "type": "string",
              "minLength": 1
            }
          }
        }
      }
    }
  }
}
